{
  "meta": {
    "name": "AI-ChainGraph fictional import example",
    "data_version": "example-2026-07-04",
    "dataset_id": "example-fictional-ai-chain",
    "dataset_type": "demo",
    "source_policy": "public_demo_only",
    "updated_at": "2026-07-04T00:00:00.000Z",
    "disclaimer": "This fictional snapshot is only for import testing and UI onboarding. It is not investment advice."
  },
  "chains": [
    {
      "id": "compute_hardware",
      "name": "算力硬件",
      "description": "虚构示例：面向 AI 训练和推理的算力基础设施。",
      "node_count": 2,
      "company_count": 2,
      "updated_at": "2026-07-04"
    }
  ],
  "nodes": [
    {
      "id": "compute_hardware",
      "name": "算力硬件",
      "node_type": "chain",
      "chain": "compute_hardware",
      "parent_id": null,
      "level": 1,
      "aliases": ["AI compute", "accelerated infrastructure"],
      "description": "虚构示例：算力硬件一级链路。",
      "source_ids": ["ev_example_chain"],
      "company_ids": ["company:DEMOA.SH", "company:DEMOUS"],
      "status": "active",
      "updated_at": "2026-07-04"
    },
    {
      "id": "seg_ai_server_example",
      "name": "AI 服务器",
      "node_type": "segment",
      "chain": "compute_hardware",
      "parent_id": "compute_hardware",
      "level": 2,
      "aliases": ["AI server", "training server"],
      "description": "虚构示例：承载模型训练和推理工作负载的服务器环节。",
      "source_ids": ["ev_example_chain"],
      "company_ids": ["company:DEMOA.SH", "company:DEMOUS"],
      "status": "active",
      "updated_at": "2026-07-04"
    }
  ],
  "companies": [
    {
      "id": "company:DEMOA.SH",
      "stock_code": "DEMOA.SH",
      "stock_symbol": "DEMOA",
      "exchange": "SH",
      "name": "示例算力股份",
      "full_name": "示例算力股份有限公司",
      "industry": "AI Infrastructure",
      "listed_at": null,
      "aliases": ["Demo Compute A"],
      "source_ids": ["ev_example_company_a"],
      "updated_at": "2026-07-04"
    },
    {
      "id": "company:DEMOUS",
      "stock_code": "DEMO",
      "stock_symbol": "DEMO",
      "exchange": "NASDAQ",
      "name": "Demo Compute Systems",
      "full_name": "Demo Compute Systems Inc.",
      "industry": "AI Infrastructure",
      "listed_at": null,
      "aliases": ["Demo Compute US"],
      "source_ids": ["ev_example_company_us"],
      "updated_at": "2026-07-04"
    }
  ],
  "edges": [
    {
      "id": "edge_example_chain_server",
      "from_id": "compute_hardware",
      "to_id": "seg_ai_server_example",
      "edge_type": "industry_parent",
      "direction": "directed",
      "weight": 0.9,
      "evidence_level": "L1",
      "relevance_score": 0.9,
      "purity_score": 0.9,
      "confidence": 0.9,
      "source_ids": ["ev_example_chain"],
      "review_status": "accepted",
      "valid_from": "2026-07-04",
      "valid_to": null,
      "created_at": "2026-07-04T00:00:00.000Z",
      "updated_at": "2026-07-04T00:00:00.000Z"
    },
    {
      "id": "edge_example_company_a_server",
      "from_id": "seg_ai_server_example",
      "to_id": "company:DEMOA.SH",
      "edge_type": "company_maps_to_industry_node",
      "direction": "directed",
      "weight": 0.82,
      "evidence_level": "L2",
      "relevance_score": 0.82,
      "purity_score": 0.76,
      "confidence": 0.74,
      "source_ids": ["ev_example_company_a"],
      "review_status": "accepted",
      "valid_from": "2026-07-04",
      "valid_to": null,
      "created_at": "2026-07-04T00:00:00.000Z",
      "updated_at": "2026-07-04T00:00:00.000Z"
    },
    {
      "id": "edge_example_company_us_server",
      "from_id": "seg_ai_server_example",
      "to_id": "company:DEMOUS",
      "edge_type": "company_maps_to_industry_node",
      "direction": "directed",
      "weight": 0.7,
      "evidence_level": "L3",
      "relevance_score": 0.7,
      "purity_score": 0.62,
      "confidence": 0.55,
      "source_ids": ["ev_example_company_us"],
      "review_status": "needs_review",
      "valid_from": "2026-07-04",
      "valid_to": null,
      "created_at": "2026-07-04T00:00:00.000Z",
      "updated_at": "2026-07-04T00:00:00.000Z"
    }
  ],
  "evidences": [
    {
      "id": "ev_example_chain",
      "target_type": "edge",
      "target_id": "edge_example_chain_server",
      "level": "L1",
      "source_type": "manual",
      "title": "Fictional chain structure example",
      "url": null,
      "local_path": null,
      "publish_date": "2026-07-04",
      "excerpt": "虚构示例：AI 服务器属于算力硬件链路。",
      "language": "zh",
      "reliability": 0.9,
      "mapped_at": "2026-07-04T00:00:00.000Z",
      "reviewed_at": "2026-07-04T00:00:00.000Z",
      "reviewer": "demo",
      "stale_threshold_days": 365,
      "notes": "Fictional import example."
    },
    {
      "id": "ev_example_company_a",
      "target_type": "edge",
      "target_id": "edge_example_company_a_server",
      "level": "L2",
      "source_type": "manual",
      "title": "Fictional A-share mapping example",
      "url": null,
      "local_path": null,
      "publish_date": "2026-07-04",
      "excerpt": "虚构示例：示例算力股份被映射到 AI 服务器环节，用于验证导入流程。",
      "language": "zh",
      "reliability": 0.76,
      "mapped_at": "2026-07-04T00:00:00.000Z",
      "reviewed_at": "2026-07-04T00:00:00.000Z",
      "reviewer": "demo",
      "stale_threshold_days": 365,
      "notes": "Fictional import example."
    },
    {
      "id": "ev_example_company_us",
      "target_type": "edge",
      "target_id": "edge_example_company_us_server",
      "level": "L3",
      "source_type": "manual",
      "title": "Fictional US mapping example",
      "url": null,
      "local_path": null,
      "publish_date": "2026-07-04",
      "excerpt": "Fictional example: Demo Compute Systems is a review-required AI server mapping.",
      "language": "en",
      "reliability": 0.55,
      "mapped_at": "2026-07-04T00:00:00.000Z",
      "reviewed_at": null,
      "reviewer": "demo",
      "stale_threshold_days": 365,
      "notes": "Fictional import example."
    }
  ],
  "quote_snapshots": [
    {
      "id": "quote:DEMOA.SH:example",
      "stock_code": "DEMOA.SH",
      "name": "示例算力股份",
      "industry": "AI Infrastructure",
      "market_cap": 128.4,
      "latest_price": 42.6,
      "change_pct": 0.8,
      "turnover_amount": 1.2,
      "pe": 36.5,
      "pb": 4.1,
      "quote_time": "2026-07-04T00:00:00.000Z",
      "source": "fictional_example",
      "source_delay_note": "Fictional demo quote. Not market data.",
      "refresh_job_id": "quote_job:example"
    },
    {
      "id": "quote:DEMO:example",
      "stock_code": "DEMO",
      "name": "Demo Compute Systems",
      "industry": "AI Infrastructure",
      "market_cap": 86.2,
      "latest_price": 58.4,
      "change_pct": -0.4,
      "turnover_amount": 2.3,
      "pe": 44.8,
      "pb": 6.2,
      "quote_time": "2026-07-04T00:00:00.000Z",
      "source": "fictional_example",
      "source_delay_note": "Fictional demo quote. Not market data.",
      "refresh_job_id": "quote_job:example"
    }
  ],
  "market_signals": [],
  "review_queue": [],
  "import_jobs": [],
  "market_signal_interface": {
    "status": "reserved",
    "endpoint_contract": "/api/signals",
    "accepted_payload": "market_signal[]",
    "note": "Example snapshot keeps the interface reserved and does not generate market signals."
  }
}
